{"$id":"urn:hioc:pe4:ha-association-adapter-predeployment-correction:1.0","$schema":"https://json-schema.org/draft/2020-12/schema","additionalProperties":false,"properties":{"adapter_network_execution":{"const":false},"corrections":{"const":["CANONICAL_ENVELOPE_EXACT_ROOT_TYPES","STATE_AND_CREDENTIAL_FILESYSTEM_SECURITY_CONTEXTS","COMBINED_CONNECTION_IDENTIFIER_NAMESPACE_BOUND"],"items":{"type":"string"},"maxItems":3,"minItems":3,"type":"array"},"credential_read_normalization":{"const":"REQUIRE_AND_REMOVE_EXACTLY_ONE_FINAL_LF_NO_TRIM"},"credential_representation":{"const":"TOKEN_PLUS_EXACTLY_ONE_FINAL_LF"},"historical_implementation_record":{"additionalProperties":false,"properties":{"git_blob":{"const":"4c5164cc056f1556e812d20c0782888f2b1f8e59"},"path":{"const":"governance/pe4/pe4-ha-association-adapter-implementation.json"},"sha256":{"const":"ad57247eee7b10603e11086b37b12ae7dbaa322f187a7f45f01b06c0fbde5d97"}},"required":["git_blob","path","sha256"],"type":"object"},"historical_implementation_schema":{"additionalProperties":false,"properties":{"git_blob":{"const":"e96577da08ccb7aab9b094935dfa333a78d02bad"},"path":{"const":"governance/pe4/pe4-ha-association-adapter-implementation.schema.json"},"sha256":{"const":"60c4d42cadc384bbe35d2972c2199f27b87bbde067e67a5c4d084c86c97461c6"}},"required":["git_blob","path","sha256"],"type":"object"},"inventory_root_types":{"additionalProperties":false,"properties":{"dependencies":{"const":"object"},"devices":{"const":"array"},"schema_version":{"const":"1.0"},"services":{"const":"array"},"summary":{"const":"object"},"topology":{"const":"object"},"updated":{"const":"AWARE_TIMESTAMP_STRING"}},"required":["dependencies","devices","schema_version","services","summary","topology","updated"],"type":"object"},"lifecycle":{"additionalProperties":false,"properties":{"adapter_implementation":{"const":"PASS_CLOSED_CORRECTED_BEFORE_DEPLOYMENT"},"deployment":{"const":"NOT_STARTED"},"pe4":{"const":"NOT_COMPLETE"},"phase7a":{"const":"ACTIVE"},"public_projection":{"const":"DEFERRED"},"rollback":{"const":"NOT_PERFORMED"},"scheduler_deployment":{"const":"NOT_STARTED"}},"required":["adapter_implementation","deployment","pe4","phase7a","public_projection","rollback","scheduler_deployment"],"type":"object"},"mqtt":{"const":false},"namespace_resolution":{"additionalProperties":false,"properties":{"authority":{"additionalProperties":false,"properties":{"git_blob":{"const":"7581ea89e40c5fb5b8eca60753b457eac2f4aa28"},"path":{"const":"governance/pe4/pe4-ha-association-adapter-implementation-preparation.json"},"sha256":{"const":"e014ce6a7b70db26f9d643318d93b8da9e6050afedbd09fe73e86e0efbd14d0b"}},"required":["git_blob","path","sha256"],"type":"object"},"disposition":{"const":"B_BOTH_CONNECTIONS_AND_IDENTIFIERS"},"historical_reducer":{"additionalProperties":false,"properties":{"git_blob":{"const":"9e77993c3f6a533b3d394017d4d97e2366959797"},"path":{"const":"tools/hioc-pe4-ha-registry-discovery.py"},"sha256":{"const":"b074608e98e887767be964120e8bfad8b5f7fba5fa17d671b0a1a1704f35c1b8"}},"required":["git_blob","path","sha256"],"type":"object"},"identifier_identity_authority":{"const":false},"identifiers_optional":{"const":true},"max_distinct_union":{"const":128},"pair_shape":{"const":"ARRAY_OF_EXACT_TWO_NONEMPTY_STRINGS_MAX_1024"},"raw_identifier_persistence":{"const":false}},"required":["authority","disposition","historical_reducer","identifier_identity_authority","identifiers_optional","max_distinct_union","pair_shape","raw_identifier_persistence"],"type":"object"},"next_checkpoint":{"const":"PE-4 Home Assistant Association Adapter Deployment Preparation"},"production_access":{"const":false},"production_mutation":{"const":false},"real_credential_used":{"const":false},"record_type":{"const":"PE4_HA_ASSOCIATION_ADAPTER_PREDEPLOYMENT_CORRECTION"},"security_stages":{"additionalProperties":false,"properties":{"contract_boundary":{"const":"CONTRACT_VALIDATION"},"inventory_boundary":{"const":"CANONICAL_INVENTORY_INPUT"},"lock_boundary":{"const":"LOCK_ACQUISITION"},"native_credential":{"const":"CREDENTIAL_ACQUISITION"},"posix_state":{"const":"STATE_PUBLICATION"},"prior_boundary":{"const":"PRIOR_STATE_VALIDATION"}},"required":["contract_boundary","inventory_boundary","lock_boundary","native_credential","posix_state","prior_boundary"],"type":"object"},"sources":{"additionalProperties":false,"properties":{"entrypoint":{"additionalProperties":false,"properties":{"git_blob":{"const":"2864361fac7cd48e947dac1e4e40aeeeb525adef"},"path":{"const":"pi4/bin/hioc-home-assistant-association.py"},"sha256":{"const":"005fae482a4e2c42b48bfb991abf14ddf1d9de60f81169a2ed1573a767958b8c"}},"required":["git_blob","path","sha256"],"type":"object"},"module":{"additionalProperties":false,"properties":{"git_blob":{"const":"0c049b7ee19b6b20c3fef53717455ba341d4a149"},"path":{"const":"pi4/lib/hioc/home_assistant_association.py"},"sha256":{"const":"cf04d05f6215b9654539df69797de49a831044795ba8f7f5b3432d9d35a086b9"}},"required":["git_blob","path","sha256"],"type":"object"}},"required":["entrypoint","module"],"type":"object"},"starting_implementation_commit":{"const":"0bdb9340157daba4a6948251922d762cc4fc97ff"},"status":{"const":"PASS_CLOSED"},"validation":{"additionalProperties":false,"properties":{"focused_tests":{"const":70},"new_focused_tests":{"const":10},"regression_tests":{"const":275},"skip_reason":{"const":"rsync is not installed"},"total_passed":{"const":344},"total_run":{"const":345},"total_skipped":{"const":1}},"required":["focused_tests","new_focused_tests","regression_tests","skip_reason","total_passed","total_run","total_skipped"],"type":"object"}},"required":["adapter_network_execution","corrections","credential_read_normalization","credential_representation","historical_implementation_record","historical_implementation_schema","inventory_root_types","lifecycle","mqtt","namespace_resolution","next_checkpoint","production_access","production_mutation","real_credential_used","record_type","security_stages","sources","starting_implementation_commit","status","validation"],"type":"object"}
