{"adapter_network_execution":false,"corrections":["CANONICAL_ENVELOPE_EXACT_ROOT_TYPES","STATE_AND_CREDENTIAL_FILESYSTEM_SECURITY_CONTEXTS","COMBINED_CONNECTION_IDENTIFIER_NAMESPACE_BOUND"],"credential_read_normalization":"REQUIRE_AND_REMOVE_EXACTLY_ONE_FINAL_LF_NO_TRIM","credential_representation":"TOKEN_PLUS_EXACTLY_ONE_FINAL_LF","historical_implementation_record":{"git_blob":"4c5164cc056f1556e812d20c0782888f2b1f8e59","path":"governance/pe4/pe4-ha-association-adapter-implementation.json","sha256":"ad57247eee7b10603e11086b37b12ae7dbaa322f187a7f45f01b06c0fbde5d97"},"historical_implementation_schema":{"git_blob":"e96577da08ccb7aab9b094935dfa333a78d02bad","path":"governance/pe4/pe4-ha-association-adapter-implementation.schema.json","sha256":"60c4d42cadc384bbe35d2972c2199f27b87bbde067e67a5c4d084c86c97461c6"},"inventory_root_types":{"dependencies":"object","devices":"array","schema_version":"1.0","services":"array","summary":"object","topology":"object","updated":"AWARE_TIMESTAMP_STRING"},"lifecycle":{"adapter_implementation":"PASS_CLOSED_CORRECTED_BEFORE_DEPLOYMENT","deployment":"NOT_STARTED","pe4":"NOT_COMPLETE","phase7a":"ACTIVE","public_projection":"DEFERRED","rollback":"NOT_PERFORMED","scheduler_deployment":"NOT_STARTED"},"mqtt":false,"namespace_resolution":{"authority":{"git_blob":"7581ea89e40c5fb5b8eca60753b457eac2f4aa28","path":"governance/pe4/pe4-ha-association-adapter-implementation-preparation.json","sha256":"e014ce6a7b70db26f9d643318d93b8da9e6050afedbd09fe73e86e0efbd14d0b"},"disposition":"B_BOTH_CONNECTIONS_AND_IDENTIFIERS","historical_reducer":{"git_blob":"9e77993c3f6a533b3d394017d4d97e2366959797","path":"tools/hioc-pe4-ha-registry-discovery.py","sha256":"b074608e98e887767be964120e8bfad8b5f7fba5fa17d671b0a1a1704f35c1b8"},"identifier_identity_authority":false,"identifiers_optional":true,"max_distinct_union":128,"pair_shape":"ARRAY_OF_EXACT_TWO_NONEMPTY_STRINGS_MAX_1024","raw_identifier_persistence":false},"next_checkpoint":"PE-4 Home Assistant Association Adapter Deployment Preparation","production_access":false,"production_mutation":false,"real_credential_used":false,"record_type":"PE4_HA_ASSOCIATION_ADAPTER_PREDEPLOYMENT_CORRECTION","security_stages":{"contract_boundary":"CONTRACT_VALIDATION","inventory_boundary":"CANONICAL_INVENTORY_INPUT","lock_boundary":"LOCK_ACQUISITION","native_credential":"CREDENTIAL_ACQUISITION","posix_state":"STATE_PUBLICATION","prior_boundary":"PRIOR_STATE_VALIDATION"},"sources":{"entrypoint":{"git_blob":"2864361fac7cd48e947dac1e4e40aeeeb525adef","path":"pi4/bin/hioc-home-assistant-association.py","sha256":"005fae482a4e2c42b48bfb991abf14ddf1d9de60f81169a2ed1573a767958b8c"},"module":{"git_blob":"0c049b7ee19b6b20c3fef53717455ba341d4a149","path":"pi4/lib/hioc/home_assistant_association.py","sha256":"cf04d05f6215b9654539df69797de49a831044795ba8f7f5b3432d9d35a086b9"}},"starting_implementation_commit":"0bdb9340157daba4a6948251922d762cc4fc97ff","status":"PASS_CLOSED","validation":{"focused_tests":70,"new_focused_tests":10,"regression_tests":275,"skip_reason":"rsync is not installed","total_passed":344,"total_run":345,"total_skipped":1}}
